url,image_count,comment,provide-IT-env for others,multi-component,microservices,have a test,Infrastructure for a field: all the tool necessary for something,"Duplicate images, but different configs",
https://api.github.com/repos/Codewars/codewars-runner-cli,78,"the docker-compose provides different environments, each of which is used to deploy and test a code in a given programming languages. Therefore, the project needs multiple environments, each of which is for a given programming language",programming languages,0,0,1,0,,
https://api.github.com/repos/BHITS/Consent2Share,37,"Microservices application. There are services that have the same image, but are invoked by different services. The database example, each service has his own database",0,1,1,0,0,,
https://api.github.com/repos/dceoy/docker-bio,36,a set of applications that are related to biometrics. Not sure if they depend on each other,0,0,0,0,biometric,,
https://api.github.com/repos/NoteGio/openrelay,32,Microservices application. Each service uses a different image,0,1,1,0,0,,
https://api.github.com/repos/slidewiki/slidewiki-deployment,29,Microservices application,0,1,1,0,0,,
https://api.github.com/repos/iMartinezMateu/gamecraft,29,"Microservices application that provides a platform for CI of minecraft games. They have different services that use the same image, but each service is invoked from a different component. In other words, each component uses a mysql database that is stored in a different environment",0,1,1,0,0,,
https://api.github.com/repos/osm2vectortiles/osm2vectortiles,25,"Microservices application for maps. Many services use the same image, but with different configurations; in particular the data and the commands (''command'' option)",0,1,1,0,0,1,
https://api.github.com/repos/osm2vectortiles/osm2vectortiles,25,DUPLICATE,,,,,,,
https://api.github.com/repos/Logimethods/smart-meter,25,"Microservices application for software metrics. That is another example that uses similar images for different purposes. In this case, master and slave components (e.g. ,database). They also have a testing component. ",0,1,1,1,0,1,
https://api.github.com/repos/CenterForOpenScience/osf.io,24,"Microservices web application. An intersting note about runing docker-compose in a readme file: ""useful to ensure all environment variables/volume changes are in order""",0,1,1,0,0,,
https://api.github.com/repos/OADA/oada-srvc-docker,22,"It looks like a microservice, but not clear what the project is for",,,,,,,
https://api.github.com/repos/silinternational/idp-pw-api,21,"Component based architecture as noted in the following quote. This app has testing environmnent. ""With the goal of being reusable, this application is developed with a component based architecture that allows swapping out specific components to suit your needs. All components must implement common interfaces to support this and new components can be developed to implement the interface as needed.""",0,1,0,1,0,,
https://api.github.com/repos/proofit404/asgi_rabbitmq,21,Unclear,,,,,,,
https://api.github.com/repos/intel-hpdd/intel-manager-for-lustre,21,Unclear,,,,,,,
https://api.github.com/repos/rafaeltcell/rails-waitlist,20,Unclear,,,,,,,
https://api.github.com/repos/Combitech/codefarm,20,Microservice. It is a CI platform,0,1,1,0,0,,
https://api.github.com/repos/ErnestIO/ernest,19,A set of services for managing platforms for easy deployment,tools for easy deployment,0,0,0,0,,
https://api.github.com/repos/EBIBioSamples/biosamples-v4,19,"""BioSamples stores and supplies descriptions and metadata about biological samples"" for research. They have multiple compoennts that use the same image, but with different configurations. For example, each component executes a different java projects",0,1,0,0,0,1,
https://api.github.com/repos/tom472/mediabox,19,Provide a set of independent services for media? The services are independent,0,0,0,0,Media,0,
https://api.github.com/repos/coffeine-009/Virtuoso,18,"Social network application. Another example that uses the same image for different configuration. Mongo is used by different services, each of which is using different data",0,1,0,0,0,1,
https://api.github.com/repos/Planigle/planigle,18,Each component is dedicated to testing a version of the application. It's a web application for project management. ,0,0,0,1,0,each component is used for testing a version of the app,
https://api.github.com/repos/php-enqueue/enqueue-dev,18,"A web app that ""... provides a friendly environment for productive development and testing of all Enqueue related features&packages"". docker-compose is used to prepare and build different environments for testing different enqueue applications (e.g., one component for kafka, another one for rabitmq,…). Then, there is a main component that can deploy the application under test and that component connects to each of the other enqueue components. On top of that, it has the necessary infrastructure for web apps","different environments for testing different enqueue (kafka, …) features. But, they are provided via a web app!!!",0,0,0,0,0,
https://api.github.com/repos/mozilla/MozDef,17,"A platform of multiple components (10 components), they have a testing component as well",0,1,0,1,0,0,
https://api.github.com/repos/mozilla/MozDef,17,DUPLICATE,,,,,,,
https://api.github.com/repos/rough007/CCF-VM,17,"a set of multi-component systems. In other words, they are a set of tools that are constituted of multiple components. At the end, it is not one final product",0,1,0,0,processing and advanced analysis of forensic artifacts and images.,0,
https://api.github.com/repos/Andrzej997/Streamer-Spring-Cloud-Config-Server,16,Microservices. The whole repository is for configuration of a multi-component system. Each microservice has an associated image in dockerhub,0,1,1,0,0,0,
https://api.github.com/repos/ESGF/esgf-docker,16,The stack configuration for a distributed data and computation platform. They have a repository for configuration,0,1,0,0,0,0,
https://api.github.com/repos/CoderDojo/cp-local-development,15,"Docker-compose ""is used to start the containers and set the env variables"". They are using the same image for multiple components, each of which with a different configuration that servers different purposes. E.g., a Node image for emails, another node image for a front-end service. THese different configurations include different environment settings, different volumes",0,1,0,0,0," They are using the same image for multiple components, each of which with a different configuration that servers different purposes. E.g., a Node image for emails, another node image for a front-end service. THese different configurations include different environment settings, different volumes",
https://api.github.com/repos/e-ucm/rage-analytics,15,"A multi-component architecture with multiple components that are interconnected. They didn't mention whether it's a microservice architecture. Some of these components are existing software systems such as Mongo, Redis, Elastic, … The repo is dedicated to the configuration",0,1,0,0,0,0,
https://api.github.com/repos/telemark/skoleskyss.t-fk.no,15,Not english project. It looks like multiple components that are all connected to 3 mongo databases,,,,,,,
https://api.github.com/repos/remp2020/remp,15,"a web app composed of 4 components plus the necessary infrastructure for data storage (mysql), configuration (zookeeper), and web server (nginx). No test component is observed ",0,1,0,0,0,"Just 2 components use the same image, but with different configs",
https://api.github.com/repos/unt-libraries/catalog-api,14,"A django project. It contains a set of environments for each component (databases, solr, and redis): a dev, a test environments. ",0,1,0,1,0,,
https://api.github.com/repos/rstiller/inspector-metrics,14,"15 environments that are identical for the compilation and tests, the unique difference is the version of the node that is used + a set of environments for tools that are dedicated to the monitoring of a system",0,0,0,1,0,identical environments. The unique difference is the version of NodeJS,
https://api.github.com/repos/sjphiChina/life,14,Unclear,,,,,,,
https://api.github.com/repos/yiping999/springcloud-pig,14,Unclear,,,,,,,
https://api.github.com/repos/vlam321/Inf191BloomFilter,14,"this looks like 'sharding' pattern. They have same environement repeated, each environment corresponds to a shard, which they configure as a constant + this project has 2 monitoring environments and a database",0,0,0,0,0,"this looks like 'sharding' pattern. They have same environement repeated, each environment corresponds to a shard, which they configure as a constant + this project has 2 monitoring environments and a database",
https://api.github.com/repos/notionparallax/ShadowWolf,13,Unclear,,,,,,,
https://api.github.com/repos/cstorey/nrod,13,Unclear,,,,,,,
https://api.github.com/repos/praekelt/mama-ng-deploy,13,"A repository dedicated to configuration that ""tie together and deploy the components of MAMA Nigeria""",0,1,0,0,0,Different postgress databases that are used by different components,
https://api.github.com/repos/SmartDeveloperHub/sdh-platform,13,"A repository dedicated to ""Deploying the Smart Developer Hub platform"". The platform consists of a set of tools for a platform (the link to its website is not working anymore)",0,0,0,0,0,Same images but different configurations,
https://api.github.com/repos/dvoraka/av-service,13,Unclear,,,,,,,
https://api.github.com/repos/silinternational/developer-portal,13,A php website and its environment + some testing environments,0,0,0,1,0,different commands,
https://api.github.com/repos/RystLee/DevDock,13,Not english project.,,,,,,,
https://api.github.com/repos/CRAWLZSTAGE/infra,13,"A web app (just 2 components) with its required environments (web server, postgres) + environements for monitoring (prometheus) and components communication (rabbitmq)",0,1,0,0,0,0,
https://api.github.com/repos/dvsa/mot,13,Unclear,,,,,,,
https://api.github.com/repos/matrix-org/dendrite,13,multi-component architecture. It has also a set of dependencies (kafka and postgress). ,0,1,0,compose file is removed,0,compose file is removed,
https://api.github.com/repos/btcpayserver/btcpayserver,13,"a multi-component system. The docker-compose is mainly used for testing, they have a test component that uses a dev component, which at its turn invokes the existing components. There are also some infrastructure environments",0,1,0,<-,0,different configs,
https://api.github.com/repos/EdwinVW/pitstop,13,This project is just a demonstration of how to use microservices and other techniques on a sample application (a garage),,,,,,,
https://api.github.com/repos/multimedial/Hyperledger,13,not english,,,,,,,
https://api.github.com/repos/SP7-Ritmare/starterkit,12,The project uses existing components to provide a set of services. These components include django and other services for a geographic application,0,1,0,0,0,0,
https://api.github.com/repos/bgruening/docker-galaxy-stable,12,Unclear,,,,,,,
https://api.github.com/repos/mozilla/marketplace-env,12,A multi-compoent tool (markeplace of mozilla). The tools required to set-up a backend app for mozilla,0,1,0,0,0,0,
https://api.github.com/repos/vesellov/bitdust.devel,12,Docker-compose is in a test folder!!! Not clear what this docker-compose file is for,,,,,,,
https://api.github.com/repos/Runbook/runbook,12,"""Runbook utilizes RethinkDB and Redis for data persistence, and several Python modules for communications and functionality""",0,1,0,0,0,Same images are re-used but with different commands,
https://api.github.com/repos/probr/probr-core,12,"This project use the standard web components (redis, mongo, postgres, …). Interestingly, the project uses a whole component for data instead of using volume. Though, this is a master project",0,0,0,0,0,"the project uses a whole component for data instead of using volume. Though, this is a master project",
https://api.github.com/repos/gameontext/gameon,12,a multi-component game,0,1,0,0,0,0,
https://api.github.com/repos/istresearch/traptor,12,A multi-component system for managing twitter data collection,0,1,0,0,0,"one image, but different env. Variables",
https://api.github.com/repos/EMSL-MSC/pacifica-reporting,12,A multi-component system,0,1,0,0,0,0,
https://api.github.com/repos/Minds/minds,12,"The necessary infrastructure for a web app (DB, web servers, cache, …). They have a component dedicated to the installation",0,?,0,0,0,0,
https://api.github.com/repos/bdelacretaz/sling-adaptto-2016,12,"A single component system that installs the required infrastructure for communication (activemq), database (mongo), monitoring (kibana) …",0,0,0,0,0,0,
https://api.github.com/repos/Osedea/nodock,12,"""The goal of NoDock is to provide a complete environment for your node project"" provide environment for other project",environment for a node project,0,0,0,0,0,
https://api.github.com/repos/komuW/meli,12,"This project don't use docker-compose, it provides an alternative to docker-compose. Docker-compose is used as a benchmark for comparison",,,,,,,
https://api.github.com/repos/HCScorp/soa,12,"A set of services for helping employees. They decided to go ""one web service for each""",0,1,0,0,"""an ecosystem of services dedicated to support an employee when travelling for business purpose""",0,
https://api.github.com/repos/pypa/warehouse,11,"This app has multiple components, but not one environment per component. The split apparently is just at the code level, but not environment level.",0,1,0,0,0,0,
https://api.github.com/repos/instedd/nuntium,11,"multiple disconected services, each of which if for one type of messages (e.g., sms, email, twitter, …)",0,Not clear if there is a main component that invokes the other components that are dedicated to sending different types of messages,0,0,Mails,0,
https://api.github.com/repos/astrobin/astrobin,11,"""AstroBin is an image hosting platform and social network for astrophotographers.""",0,"3 components, split into sub-components",0,0,0,0,
https://api.github.com/repos/pudo/aleph,11,"App to ""search and browse documents and data""",0,1,0,0,0,0,
https://api.github.com/repos/metabrainz/listenbrainz-server,11,"web app with its infrastructure and environments (web server, database, rabittmq, ..) for certain APIs",0,?,0,0,0,"same image is used for different components, each of which has a specific command",
https://api.github.com/repos/ec-geolink/d1lod,11,A service that is constituted of an infrastructure of multiple tools,0,?,0,0,0,0,
https://api.github.com/repos/Codeception/CodeceptJS,11,A tool for testing,-,-,-,the whole docker-compose seems to be used for creating different environments that test the provided servcies,-,-,
https://api.github.com/repos/astrobin/astrobin,11,"web app. ""The docker-compose-*.yml files contain all the instructions needed to bring up the stack""",0,1,0,0,0,0,they use docker-compose to easily reset and rebuild the environment
https://api.github.com/repos/snowplow/snowplow-mini,11,Unclear,,,,,,,
https://api.github.com/repos/AdaptiveConsulting/ReactiveTraderCloud,11,an app for tradding,0,1,0,0,0,0,
https://api.github.com/repos/dustinleblanc/veccs,11,php app,0,0,0,"They have components for the infrastructure like php and nginx, and components to test these infrastructures like testphp and testnginx. They also use the component wernight/phantomjs, which is for testing purposes",0,One real component and one similar component for testing,
https://api.github.com/repos/idugalic/micro-ecommerce,11,Not a real project. This project just demonstrate how to make a microservice application,,,,,,,
https://api.github.com/repos/backd-io/backd,11,Unclear,,,,,,,
https://api.github.com/repos/meppe/ros-ort,11,"""This repo contains start scripts, and code to run dockerized object recognition and tracking based on ROS. Docker images are based on Ubuntu 16.04 and ROS kinetic""",0,1,0,0,0,with different volumes and configurations,
https://api.github.com/repos/rudibroekhuizen/docker-postgresplus,11,"A project that provides an extension to postgres. ""PostgreSQL playground running on Docker with logs presented in Kibana dashboard and Pgadmin webinterface""",0,1,0,0,0,,
https://api.github.com/repos/OpenLMIS-Malawi/mw-ui,11,A set of Uis that constitute an app,0,1,0,0,0,,
https://api.github.com/repos/TouK/nussknacker,11,"The app contains a few components (a job manager and a task manager) and a set of infrastructure tools (kafka, grafana)",0,1,0,0,0,the two components job and task managers use the same image but different commands are executed,
https://api.github.com/repos/Arragro/ArragroCMS.Examples,11,"doesn't look to be a real project as the project has ""Example"" in its title",,,,,,,
https://api.github.com/repos/miguelfc/marble,10,A multi-component system (resulting from someone's PhD). Outdated and unmaintained,0,1,1,0,0,0,
https://api.github.com/repos/confluentinc/bottledwater-pg,10,"""docker-compose, which is used to orchestrate the interaction between services.""",0,1,0,0,0,0,
https://api.github.com/repos/greg0ire/dockerony,10,"""Leverage the power of docker to make development initialization easy. The goal is to have the members of your team ready to code very quickly ""","Set-up environment to make deployment easy. It consists of a set of tools that are prebuilt. These tools include: php, nginx, postgres, mailcatcher, …",0,0,0,0,0,
https://api.github.com/repos/JeroenBoersma/docker-compose-development,10,"""Docker-compose-development aims to be a plug 'n play setup for you to quickly start developing locally with services as NGINX, PHP, Blackfire, Percona, MailHog and more!"" The large number of images look like they are using different versions of the same system (php), each of these components is for a giving version",1,0,0,0,0,0,
https://api.github.com/repos/cloudera/ibis,10,A toolkit,"""Ibis is a toolbox to bridge the gap between local Python environments, remote storage, execution systems like Hadoop components (HDFS, Impala, Hive, Spark) and SQL databases. Its goal is to simplify analytical workflows and make you more productive.""",0,0,0,0,0,
https://api.github.com/repos/obi-a/maestro,10,Unclear,,,,,,,
https://api.github.com/repos/ebmdatalab/openprescribing,10,A web app. It has a few environment just for Dev and tests. They not using docker-compose to connect different components,0,0,0,1,0,0,
https://api.github.com/repos/webrecorder/webrecorder,10,"a web app. It has a few component for the infrastrucutre (e.g., nginx), and the web app is multiple components (e.g., a front end component, a recorder, a mailserver",0,1,0,0,0,0,
https://api.github.com/repos/spinnaker/spinnaker,10,"""Spinnaker is an open-source continuous delivery platform """,0,1,1,0,0,,
https://api.github.com/repos/mozilla/addons-server,10,"""Welcome to the [Mozilla] Addons Server repository!"". It has 4 components (front end, autograph, worker, and web), the remaining components are for the infrastructure",0,1,0,0,0,0,
https://api.github.com/repos/MUSIT-Norway/musit,10,"A set of microservices that constitute a software system, with some additional components for the infrastructure",0,1,1,0,0,0,
https://api.github.com/repos/ender74/yart,10,a website. The compose has the necessayr components for the infrastructure,0,0,0,0,0,0,
https://api.github.com/repos/holisticon/camunda-bpm-cloud,10,A microservice application created using java. The compose file has the services and some infrastructure tools such as mysql,0,1,1,0,0,0,
https://api.github.com/repos/cyber-dojo/web,10,A microservice,0,1,1,"all the container names start with ""test""",0,0,
https://api.github.com/repos/kchrusciel/OmOmFood,10,"Don't know what is the type of the applicatoin. But, from the docker-compose, it looks like a set of services",0,1,0,0,0,0,
https://api.github.com/repos/codexgigassys/codex-backend,10,A web app installed and setup using docker,0,?,?,0,0,"identical images exist, just the commands are different",
https://api.github.com/repos/telefonicaid/fiware-sinfonier,10,"A web app that is constituted of a web component, a backend, and a backendapi. On top of that, they have components for the infrastructure (mongo, zookeeper, …)",0,1,0,0,0,"they use Apache storm with different commands, which makes sense",
https://api.github.com/repos/kivy/kivy-server,10,Unclear,,,,,,,
https://api.github.com/repos/tburdett/biosamples-analysis,10,"""Contains python scripts and cypher to read BioSamples info from Solr, store in Neo4J database"". That seems to be through different docker-compose commands (docker-compose up collate-attributes docker-compose up create-csv docker-compose up populate-neo4j docker-compose up neo4j-server(-local)), each of which has a dedicated docker component",0,0,0,0,0,"They use the same image twice, one for dev and another one for prod. ",
https://api.github.com/repos/runabove/metronome,10,"A set of different instances in addition to their infrastructure (kafka, PostgreSQL, and Redis) ",0,0,0,0,,"They build the environments from a given dockerfile, and each environment/component gets a different command to execute. ",
https://api.github.com/repos/jdufner/microservice,10,Demo for a microservices app usage? Not english,,,,,,,
https://api.github.com/repos/bstaijen/mariadb-for-microservices,10,"Just an example: ""MariaDB for Microservices is a working example on how to create an application using the microservice architectural approach and the MariaDB Server."" ",,,,,,,
https://api.github.com/repos/alephdata/aleph,10,"An app for ""Search and browse documents and data; find the people and companies you look for.""",0,1,0,0,0,The same image is used 3 times but with different commands,
https://api.github.com/repos/ibis-project/ibis,10,A toolkit,1,0,0,0,0,0,
https://api.github.com/repos/nosinovacao/name-sdk,10,"""A dependencies management library designed to expose and access dependencies information.""",0,?,?,The whole docker-compose seems to be used for integration tests. The compose is setting up environments and testing them ,0,They are testing as an example rabbitmq and a specific version (3.6.5) of the same image rabbitmq,
https://api.github.com/repos/belbio/bel_api,10,Unclear,,,,,,,
https://api.github.com/repos/joaosoft/go-manager,10,Not easy to know what this project is for,0,Most of the images look like external tools,0,0,0,"They have duplicate images, each of which is with a command",
https://api.github.com/repos/ContinuITy-Project/ContinuITy,10,"A reserarch project. The compose has its components plus a set of infrastructure tools (rabittmq, jmeter, …). The Jmeter component doesn't seem to test their stuff, but it's part of the features their project provides",0,1,0,0,0,0,
https://api.github.com/repos/cualbondi/cualbondi,10,Not english,?,1,?,0,0,"They have too many duplicates, but again each of these duplicates is runing a different command",